<?xml version="1.0" encoding="UTF-8"?>
<p:testcaseDefinition xmlns:p="http://www.secunet.com"
	xmlns:xsi="http://www.w3.org/2001/XMLSchema-instance"
	xsi:schemaLocation="http://www.secunet.com ../xmlScheme/sn_TestcaseDefinition.xsd ">
	<p:name>EID_SERVER_A1_1_06</p:name>
	<p:description>Positive test of the eID-Interface interaction in case the terminal CV certificate of the eService contains two terminal sectors.</p:description>
	<p:modulePath>
		<p:node>A</p:node>
		<p:node>1</p:node>
		<p:node>1</p:node>
	</p:modulePath>
	<p:profiles>
		<p:profile>SOAP</p:profile>
		<p:profile>EID_ACCESS</p:profile>
		<p:profile>RI_MIGRATION</p:profile>
	</p:profiles>
	<p:eservice>D</p:eservice><p:clientExplanation>Configure the server to accept the certificate chain for client D. This includes the TLS, XML signature and the CV certificate.</p:clientExplanation>
	<p:eidcard>EIDCARD_1</p:eidcard>
	<p:certificateBaseNames>
		<p:certificate>CERT_EID_TLS_EIDSERVER_1</p:certificate>
	</p:certificateBaseNames>
	<p:steps>
		<p:step>OUT_USEID_REQUEST</p:step>
		<p:step>IN_USEID_RESPONSE</p:step>
		<p:reference targetInterface="eCard-API">EID_SERVER_C1_1_06</p:reference>
		<p:step>OUT_GETRESULT_REQUEST</p:step>
		<p:step>IN_GETRESULT_RESPONSE_RESTRICTEDID</p:step>
	</p:steps>
	<p:variables>
		<p:variable name="USEOP_RESTRICTEDID">REQUIRED</p:variable>
	</p:variables>
</p:testcaseDefinition>