<?xml version="1.0" encoding="UTF-8"?>
<p:testcaseDefinition xmlns:p="http://www.secunet.com"
	xmlns:xsi="http://www.w3.org/2001/XMLSchema-instance"
	xsi:schemaLocation="http://www.secunet.com ../xmlScheme/sn_TestcaseDefinition.xsd ">
	<p:name>EID_SERVER_B2_1_03_DSA</p:name>
	<p:description>This test case checks the behaviour of the eID-Server in case the SAML message contains an invalid XML signature.</p:description>
	<p:modulePath>
		<p:node>B</p:node>
		<p:node>2</p:node>
		<p:node>1</p:node>
	</p:modulePath>
	<p:profiles>
		<p:profile>SAML</p:profile>
		<p:profile>CRYPTO</p:profile>
	</p:profiles>
	<p:eservice>EDSA</p:eservice><p:clientExplanation>Configure the server to accept the certificate chain for client E. This includes the TLS, XML signature and the CV certificate.</p:clientExplanation>
	<p:certificateBaseNames>
		<p:certificate>CERT_ECARD_TLS_EIDSERVER_1</p:certificate>
	</p:certificateBaseNames>
	<p:steps>
		<p:step>OUT_CALL_SAML_INCL_AUTHNREQUEST</p:step>
		<p:step>IN_BAD_REQUEST</p:step>
	</p:steps>
	<p:variables>
		<p:variable name="XML_SIGNATURE">DSA_MANIPULATED</p:variable>
	</p:variables>
</p:testcaseDefinition>