<?xml version="1.0" encoding="UTF-8"?>
<p:testcaseDefinition xmlns:p="http://www.secunet.com"
	xmlns:xsi="http://www.w3.org/2001/XMLSchema-instance"
	xsi:schemaLocation="http://www.secunet.com ../xmlScheme/sn_TestcaseDefinition.xsd ">
	<p:name>EID_SERVER_A3_06</p:name>
	<p:description>This test checks the behaviour of the eID-Server in case TLS client authentication of the eService fails. The client does not send a client certificate during handshake.</p:description>
	<p:modulePath>
		<p:node>A</p:node>
		<p:node>3</p:node>
	</p:modulePath>
	<p:profiles>
		<p:profile>SOAP</p:profile>
		<p:profile>SOAP_TLS</p:profile>
		<p:profile>CRYPTO</p:profile>
	</p:profiles>
	<p:eservice>A</p:eservice>
	<p:steps>
		<p:step>OUT_TLS_EID</p:step>
	</p:steps>
	<p:variables>
		<p:variable name="TLS_VERSION">TLSv12</p:variable>
		<p:variable name="TLS_SELECTED_VERSION">TLSv12</p:variable>
		<p:variable name="TLS_CIPHER_SUITES">TLS_ECDHE_RSA_WITH_AES_128_CBC_SHA</p:variable>
		<p:variable name="TLS_SELECTED_CIPHER_SUITE">TLS_ECDHE_RSA_WITH_AES_128_CBC_SHA</p:variable>
		<p:variable name="TLS_ELLIPTIC_CURVES">secp256r1,secp384r1</p:variable>
		<p:variable name="TLS_SUPPORTED_SIGNATURE_ALGORITHMS">SHA1withRSA</p:variable>
		<p:variable name="TLS_CLIENT_AUTHENTICATION">false</p:variable>
		<p:variable name="TLS_ALERT_LEVEL_RECEIVED">2</p:variable>
	</p:variables>
	
</p:testcaseDefinition>