<?xml version="1.0" encoding="UTF-8"?>
<p:testcaseDefinition xmlns:p="http://www.secunet.com"
	xmlns:xsi="http://www.w3.org/2001/XMLSchema-instance"
	xsi:schemaLocation="http://www.secunet.com ../../xmlScheme/sn_TestcaseDefinition.xsd ">
	<p:name>EID_SERVER_C1_1_15</p:name>
	<p:description>Positive test describing the PAOS communication between the eIDServer and the eID-Client. The eIDAS request requires to read the minimum dataset.</p:description>
	<p:modulePath>
		<p:node>C</p:node>
		<p:node>1</p:node>
		<p:node>1</p:node>
	</p:modulePath>
	<p:profiles>
		<p:profile>EAC</p:profile>
		<p:profile>PAOS</p:profile>
		<p:profile>EID_ACCESS</p:profile>
		<p:profile>EIDAS_MW</p:profile>
	</p:profiles>
	<p:eservice>F</p:eservice>
	<p:clientExplanation>Configure the server to accept the certificate chain for client F. This includes the TLS, XML signature and the CV certificate.</p:clientExplanation>
	<p:eidcard>EIDCARD_1</p:eidcard>
	<p:steps>
		<p:step>OUT_EIDAS_REQUEST_POST</p:step>
		<p:step>IN_ATTACHED_WEBPAGE</p:step>
		<p:step>OUT_GET_TCTOKEN</p:step>
		<p:step>IN_TC_TOKEN_ATTACHED</p:step>

		<p:step>OUT_START_PAOS</p:step>
		<p:step>IN_INITIALIZE_FRAMEWORK</p:step>
		<p:step>OUT_INITIALIZE_FRAMEWORK_RESPONSE</p:step>
		<p:step>IN_DIDLIST</p:step>
		<p:step>OUT_DIDLIST</p:step>
		<p:step>IN_DID_AUTHENTICATE_EAC_1_INPUTTYPE</p:step>
		<p:step>OUT_DID_AUTHENTICATE_EAC_1_OUTPUTTYPE_WITH_CHAT</p:step>
		<p:step>IN_DID_AUTHENTICATE_EAC_2_INPUTTYPE</p:step>
		<p:step>OUT_DID_AUTHENTICATE_EAC_2_OUTPUTTYPE_B</p:step>
		<p:step>IN_DID_AUTHENTICATE_EACADDITIONALINPUTTYPE</p:step>
		<p:step>OUT_DID_AUTHENTICATE_EAC_2_OUTPUTTYPE_A</p:step>
		<p:step>IN_TRANSMIT</p:step>
		<p:step>OUT_TRANSMIT</p:step>
		<p:step>IN_START_PAOS_RESPONSE</p:step>
	</p:steps>
	<p:variables>
		<p:variable name="REQUIREDCHAT">7F4C12060904007F00070301020253050000009804</p:variable> <!-- If present, the element "RequiredCHAT" contains the CHAT value for reading [ATTRIBUTE_SET1]. -->
	</p:variables>
</p:testcaseDefinition>