<?xml version="1.0" encoding="UTF-8"?>
<p:testcaseDefinition xmlns:p="http://www.secunet.com"
	xmlns:xsi="http://www.w3.org/2001/XMLSchema-instance"
	xsi:schemaLocation="http://www.secunet.com ../xmlScheme/sn_TestcaseDefinition.xsd ">
	<p:name>EID_SERVER_B2_1_01_ECDSA</p:name>
	<p:description>Positive test verifying the eID-Server to support all algorithms and parameters listed in the ICS for verification of XML signatures during communication using the SAML-Profile.</p:description>
	<p:modulePath>
		<p:node>B</p:node>
		<p:node>2</p:node>
		<p:node>1</p:node>
	</p:modulePath>
	<p:profiles>
		<p:profile>SAML</p:profile>
		<p:profile>CRYPTO</p:profile>
	</p:profiles>
	<p:eservice>EECDSA</p:eservice><p:clientExplanation>Configure the server to accept the certificate chain for client E. This includes the TLS, XML signature and the CV certificate.</p:clientExplanation>
	<p:certificateBaseNames>
		<p:certificate>CERT_ECARD_TLS_EIDSERVER_1</p:certificate>
	</p:certificateBaseNames>
	<p:steps>
		<p:step>OUT_CALL_SAML_INCL_AUTHNREQUEST</p:step>
		<p:step>IN_TC_TOKEN</p:step>
	</p:steps>
	<p:variables>
		<p:variable name="XML_SIGNATURE">ECDSA</p:variable>
		
		<p:variable name="USEOP_FAMILYNAMES"/>
	</p:variables>
</p:testcaseDefinition>