<?xml version="1.0" encoding="UTF-8"?>
<p:testcaseDefinition xmlns:p="http://www.secunet.com"
	xmlns:xsi="http://www.w3.org/2001/XMLSchema-instance"
	xsi:schemaLocation="http://www.secunet.com ../xmlScheme/sn_TestcaseDefinition.xsd ">
	<p:name>EID_SERVER_C2_2_04</p:name>
	<p:description>This test case checks the behaviour of the eID-Server in case the eID-Client only offers elliptic curves that do not match the requirements of [TR-03130-1].</p:description>
	<p:modulePath>
		<p:node>C</p:node>
		<p:node>2</p:node>
		<p:node>2</p:node>
	</p:modulePath>
	<p:profiles>
		<p:profile>PAOS</p:profile>
		<p:profile>EAC</p:profile>
		<p:profile>CRYPTO</p:profile>
		<p:profile>ESER_ATTACHED</p:profile>
	</p:profiles>
	<p:eservice>A</p:eservice>
	<p:certificateBaseNames>
		<p:certificate>CERT_EID_TLS_EIDSERVER_1</p:certificate>
	</p:certificateBaseNames>
	<p:steps>
		<p:step>OUT_TLS_ATTACHED</p:step>
	</p:steps>
	<p:variables>
		<p:variable name="TLS_VERSION">TLSv12</p:variable>
		<p:variable name="TLS_SELECTED_VERSION">TLSv12</p:variable>
		<p:variable name="TLS_CIPHER_SUITES">TLS_ECDHE_RSA_WITH_AES_128_CBC_SHA256</p:variable>
		<p:variable name="TLS_SELECTED_CIPHER_SUITE">TLS_ECDHE_RSA_WITH_AES_128_CBC_SHA256</p:variable>
		<p:variable name="TLS_ELLIPTIC_CURVES">secp192r1,secp160r1</p:variable>
		<p:variable name="TLS_SUPPORTED_SIGNATURE_ALGORITHMS">SHA256withRSA</p:variable>
		<p:variable name="TLS_ALERT_LEVEL_RECEIVED">2</p:variable>
	</p:variables>
</p:testcaseDefinition>