<?xml version="1.0" encoding="UTF-8"?>
<p:testcaseDefinition xmlns:p="http://www.secunet.com"
	xmlns:xsi="http://www.w3.org/2001/XMLSchema-instance"
	xsi:schemaLocation="http://www.secunet.com ../xmlScheme/sn_TestcaseDefinition.xsd ">
	<p:name>EID_SERVER_A1_3_04</p:name>
	<p:description>Positive test describing the eID-Interface interaction utilizing a PSK predefined by the eService.</p:description>
	<p:modulePath>
		<p:node>A</p:node>
		<p:node>1</p:node>
		<p:node>3</p:node>
	</p:modulePath>
	<p:profiles>
		<p:profile>SOAP</p:profile>
	</p:profiles>
	<p:eservice>B</p:eservice><p:clientExplanation>Configure the server to accept the certificate chain for client B. This includes the TLS, XML signature and the CV certificate.</p:clientExplanation>
	<p:eidcard>EIDCARD_1</p:eidcard>
	<p:certificateBaseNames>
		<p:certificate>CERT_EID_TLS_EIDSERVER_1</p:certificate>
	</p:certificateBaseNames>
	<p:steps>
		<p:step>OUT_USEID_REQUEST_PSK</p:step>
		<p:step>IN_USEID_RESPONSE_PSK</p:step>
		<p:reference targetInterface="eCard-API">EID_SERVER_C1_1_13</p:reference>
		<p:step>OUT_GETRESULT_REQUEST</p:step>
		<p:step>IN_GETRESULT_RESPONSE_SET1</p:step>
	</p:steps>
	<p:variables>
		<!-- The element "PSK" contains a valid [PSK]. -->
		<p:variable name="PSK_ID">AAAAAAAAAAAAAAAAAAAAAAAAAAAAAAAA</p:variable>
		<p:variable name="PSK_KEY">BBBBBBBBBBBBBBBBBBBBBBBBBBBBBBBBBBBBBBBBBBBBBBBBBBBBBBBBBBBBBBBBBBBBBBBBBB</p:variable>
	</p:variables>
</p:testcaseDefinition>