<?xml version="1.0" encoding="UTF-8"?>
<p:testcaseDefinition xmlns:p="http://www.secunet.com"
	xmlns:xsi="http://www.w3.org/2001/XMLSchema-instance"
	xsi:schemaLocation="http://www.secunet.com ../xmlScheme/sn_TestcaseDefinition.xsd ">
	<p:name>EID_SERVER_B1_2_05</p:name>
	<p:description>This test case checks the behavior of the eID-Server at the SAML-Interface in case the eID-Card is expired.</p:description>
	<p:modulePath>
		<p:node>B</p:node>
		<p:node>1</p:node>
		<p:node>2</p:node>
	</p:modulePath>
	<p:profiles>
		<p:profile>SAML</p:profile>
		<p:profile>EXPIRED_CARD</p:profile>
		<p:profile>TLS_PSK</p:profile>
	</p:profiles>
	<p:eservice>B</p:eservice><p:clientExplanation>Configure the server to accept the certificate chain for client B. This includes the TLS, XML signature and the CV certificate.</p:clientExplanation>
	<p:eidcard>EIDCARD_7</p:eidcard>
	<p:certificateBaseNames>
		<p:certificate>CERT_ECARD_TLS_EIDSERVER_1</p:certificate>
	</p:certificateBaseNames>
	<p:steps>
		<p:step>OUT_CALL_SAML_INCL_AUTHNREQUEST</p:step>
		<p:step>IN_TC_TOKEN</p:step>
		<p:reference targetInterface="eCard-API">EID_SERVER_C1_2_10</p:reference>
	 	<p:step>OUT_SAML_ASSERTION</p:step>
	 	<p:step>IN_SAML_ASSERTION</p:step>
	</p:steps>
	<p:variables>
		<p:variable name="USEOP_FAMILYNAMES"/>
		<p:variable name="USEOP_RESTRICTEDID"/>
		<p:variable name="USEOP_AGEVERIFICATION"/>
		<p:variable name="USEOP_PLACEVERIFICATION"/>
		
		<p:variable name="DOCUMENT_VALIDITY">expired</p:variable>
	</p:variables>
</p:testcaseDefinition>