<?xml version="1.0" encoding="UTF-8"?>
<p:testcaseDefinition xmlns:p="http://www.secunet.com"
	xmlns:xsi="http://www.w3.org/2001/XMLSchema-instance"
	xsi:schemaLocation="http://www.secunet.com ../xmlScheme/sn_TestcaseDefinition.xsd ">
	<p:name>EID_SERVER_B1_4_04_DateOfBirth</p:name>
	<p:description>Positive test describing the SAML interaction during Online-Authentication in case the user restricts access to a required attribute.</p:description>
	<p:modulePath>
		<p:node>B</p:node>
		<p:node>1</p:node>
		<p:node>4</p:node>
	</p:modulePath>
	<p:profiles>
		<p:profile>SAML</p:profile>
		<p:profile>EID_ACCESS</p:profile>
		<p:profile>SAML_ATTACHED</p:profile>
	</p:profiles>
	<p:eservice>A</p:eservice>
	<p:eidcard>EIDCARD_1</p:eidcard>
	<p:certificateBaseNames>
		<p:certificate>CERT_ECARD_TLS_EIDSERVER_1</p:certificate>
	</p:certificateBaseNames>
	<p:steps>
		<p:step>OUT_CALL_SAML_INCL_AUTHNREQUEST</p:step>
		<p:step>IN_TC_TOKEN_SAML_ATTACHED</p:step>
		<p:reference targetInterface="eCard-API">EID_SERVER_C1_1_03_DateOfBirth</p:reference>
	 	<p:step>OUT_SAML_ASSERTION</p:step>
		<p:step>IN_SAML_ASSERTION</p:step>
	</p:steps>
	<p:variables>
		<p:variable name="USEOP_FAMILYNAMES">REQUIRED</p:variable> <!-- [DGROUP_B] -->
		<p:variable name="USEOP_DATEOFBIRTH">REQUIRED</p:variable> <!-- [ATTRIBUTE_DEN] -->
		
		<p:variable name="OABU_FAMILYNAMES">ALLOWED</p:variable> <!-- [DGROUP_B]  -->
		<p:variable name="OABU_DATEOFBIRTH">PROHIBITED</p:variable> <!-- [ATTRIBUTE_DEN] -->
		<p:variable name="PERSONAL_FAMILYNAMES">MUSTERMANN</p:variable>
	</p:variables>
</p:testcaseDefinition>