<?xml version="1.0" encoding="UTF-8"?>
<p:testcaseDefinition xmlns:p="http://www.secunet.com"
	xmlns:xsi="http://www.w3.org/2001/XMLSchema-instance"
	xsi:schemaLocation="http://www.secunet.com ../xmlScheme/sn_TestcaseDefinition.xsd ">
	<p:name>EID_SERVER_B3_03</p:name>
	<p:description>This test case checks the behaviour of the SAML-Processor of the eID-Server in case the cipher suites proposed during handshake do not meet the requirements stated in [TR-03130-1].</p:description>
	<p:modulePath>
		<p:node>B</p:node>
		<p:node>3</p:node>
	</p:modulePath>
	<p:profiles>
		<p:profile>SAML</p:profile>
		<p:profile>CRYPTO</p:profile>
	</p:profiles>
	<p:eservice>ERSA</p:eservice><p:clientExplanation>Configure the server to accept the certificate chain for client E. This includes the TLS, XML signature and the CV certificate.</p:clientExplanation>
	<p:certificateBaseNames>
		<p:certificate>CERT_EID_TLS_EIDSERVER_1</p:certificate>
	</p:certificateBaseNames>
	<p:steps>
		<p:step>OUT_TLS_SAML</p:step>
	</p:steps>
	<p:variables>
		<p:variable name="TLS_VERSION">TLSv12</p:variable>
		<p:variable name="TLS_CIPHER_SUITES">TLS_DHE_RSA_WITH_3DES_EDE_CBC_SHA,TLS_DHE_RSA_WITH_AES_128_CBC_SHA,TLS_DHE_RSA_WITH_AES_256_CBC_SHA</p:variable>
		<p:variable name="TLS_SELECTED_CIPHER_SUITE">TLS_DHE_RSA_WITH_3DES_EDE_CBC_SHA</p:variable>
		<p:variable name="TLS_ELLIPTIC_CURVES">secp256r1,secp384r1</p:variable>
		<p:variable name="TLS_SUPPORTED_SIGNATURE_ALGORITHMS">SHA256withRSA</p:variable>
		<p:variable name="TLS_ALERT_LEVEL_RECEIVED">2</p:variable>
	</p:variables>
</p:testcaseDefinition>