<?xml version="1.0" encoding="UTF-8"?>
<p:testcaseDefinition xmlns:p="http://www.secunet.com"
	xmlns:xsi="http://www.w3.org/2001/XMLSchema-instance"
	xsi:schemaLocation="http://www.secunet.com ../xmlScheme/sn_TestcaseDefinition.xsd ">
	<p:name>EID_SERVER_A1_1_05_EIDCARD_2</p:name>
	<p:description>Positive test describing the eID-Interface interaction in case of requested data groups being not present or empty.</p:description>
	<p:modulePath>
		<p:node>A</p:node>
		<p:node>1</p:node>
		<p:node>1</p:node>
	</p:modulePath>
	<p:profiles>
		<p:profile>SOAP</p:profile>
		<p:profile>EID_ACCESS</p:profile>
		<p:profile>DG_VARIATIONS</p:profile>
	</p:profiles>
	<p:eservice>A</p:eservice>
	<p:eidcard>EIDCARD_2</p:eidcard>
	<p:certificateBaseNames>
		<p:certificate>CERT_EID_TLS_EIDSERVER_1</p:certificate>
	</p:certificateBaseNames>
	<p:steps>
		<p:step>OUT_USEID_REQUEST_ALL</p:step>
		<p:step>IN_USEID_RESPONSE</p:step>
		<p:reference targetInterface="eCard-API">EID_SERVER_C1_1_05_EIDCARD_2</p:reference>
		<p:step>OUT_GETRESULT_REQUEST</p:step>
		<p:step>IN_GETRESULT_RESPONSE_EIDCARD_2</p:step>
	</p:steps>
</p:testcaseDefinition>