<?xml version="1.0" encoding="UTF-8"?>
<p:testcaseDefinition xmlns:p="http://www.secunet.com"
	xmlns:xsi="http://www.w3.org/2001/XMLSchema-instance"
	xsi:schemaLocation="http://www.secunet.com ../xmlScheme/sn_TestcaseDefinition.xsd ">
	<p:name>EID_SERVER_A2_02_RSA</p:name>
	<p:description>This test case checks the behaviour of the eID-Server in case the eService uses an invalid XML signature during communication over the eID-Interface.</p:description>
	<p:modulePath>
		<p:node>A</p:node>
		<p:node>2</p:node>
	</p:modulePath>
	<p:profiles>
		<p:profile>SOAP</p:profile>
		<p:profile>CRYPTO</p:profile>
	</p:profiles>
	<p:eservice>ERSA</p:eservice><p:clientExplanation>Configure the server to accept the certificate chain for client E. This includes the TLS, XML signature and the CV certificate.</p:clientExplanation>
	<p:steps>
		<p:step>OUT_USEID_REQUEST</p:step>
		<p:step>IN_USEID_RESPONSE_ERROR</p:step>
	</p:steps>
	<p:variables>
		<p:variable name="XML_SIGNATURE">RSA_MANIPULATED</p:variable>
		<p:variable name="RES_MIN_IN_USEID_RESPONSE_ERROR">http://www.bsi.bund.de/eid/server/2.0/resultminor/common#internalError</p:variable>
	</p:variables>
</p:testcaseDefinition>